id_post,content,post_date,sentiment,share,source_division,title,total_comment,url,username,id_status
1,"VNPT - IT tuyển dụng Fresher fulltime/parttime Khu vực: Hà Nội, HCM, Đà Nẵng, Hải Phòng, Tiền Giang Các vị trí tuyển dụng: Lập trình (PHP, Java, .Net, Python, Nodejs, Frontend, iOS, Android, Flutter) Manual Tester AICV / AI NLP (Hà Nội) Data Engineer (Hà Nội) An toàn thông tin (Hà Nội) Gửi CV + bảng điểm để ứng tuyển Chương trình áp dụng cho các bạn sinh viên năm cuối hoặc mới tốt nghiệp không quá 1 năm khối ngành CNTT, ATTT, Kỹ thuật phần mềm Nhận lương lên đến 10tr/tháng tùy vị trí công việc ngay từ thời gian đào tạo Tham gia miễn phí các khóa đào tạo chuyên môn & kỹ năng mềm Tham gia hỗ trợ phát triển các sản phẩm với hàng chục triệu người dùng. Được tư vấn & định hướng nghề nghiệp từ các Mentors - những chuyên gia hàng đầu trong lĩnh vực CNTT. Cơ hội được tuyển dụng chính thức tại VNPT sau thời gian đào tạo với mức thu nhập năm hấp dẫn kèm các chế độ phúc lợi từ Tập đoàn VNPT ------------------------------------------------- Gửi hồ sơ ứng tuyển đến email: bannhansu.vnptit@vnpt.vn Tiêu đề email ghi rõ: Họ và tên_Vị trí dự tuyển_Địa bàn ứng tuyển",26-9-2022 21:38,,14,1,VNPT - IT tuyển dụng Fresher fulltime/parttime,163,https://www.facebook.com/groups/174764463261090/posts/1308631666541025/?__cft__[0]=AZVLi1f6e-luNHBJhySx0crOPoAHR_CQQi-tEzWxKHyuaKy9dUcO5IeLkHMKgkvAhBI8uDZw5XvWfop9S3vmNxVe5Lh9zFTcGeS4ytKSXkzkB8h2A7J4SwhXO5Ejtpw5GF25SCydL0fkbaqMQyJK5jFU&__tn__=%2CO%2CP-R,Tờ Jan,1
2,"[HN] FPT Software tìm kiếm FRESHER JAVA (Part-time) Đào tạo không yêu cầu kinh nghiệm, được nhận hỗ trợ 3-5M/ tháng Sau đào tạo offer mức lương 10-15M/ tháng Hỗ trợ dấu thực tập Bạn cần gì để ứng tuyển Fresher Java? - Nắm vững kiến thức về Lập trình hướng đối tượng, Java - Khả năng tiếng anh khá CV ứng tuyển gửi về địa chỉ: TrangKM@fsoft.com.vn",,,2,1,[HN] FPT Software tìm kiếm FRESHER JAVA (Part-time),33,https://www.facebook.com/groups/174764463261090/posts/1307237956680396/?__cft__[0]=AZWk9n-p3tCu31xLJVYFRsAF7ybz-6KnWBRraqSAKEgUOT6cqdM3JnCJaIWAO_oTiSZLAqF5708Z97g3vXYyO3m-QaNMJuNaufdBrsDu_uEhNFClxf9o8oDDpbrVzK15MZq2CJ47l6wX_yOldd95uB6l&__tn__=%2CO%2CP-R,Kim Minh Trang,158
3,"Xin phép admin!! [FPT SoftWare HN - ĐN] Tìm kiếm fresher Tháng 11 #Fresher Đào tạo từ đầu hỗ trợ 5-9m/tháng Vi trí: Fresher C#/.Net Fresher Java Fresher Embedded Fresher React Native Fresher Cloud Engineer Fresher Mobile (Android/IOS) Fresher Automation test Fresher Data Engineer - Không yêu cầu ứng viên có kinh nghiệm làm việc ngoài, chỉ cần có kinh nghiệm tham gia dự án trong lúc đi học. - Đào tạo lại từ đầu. - PV 1 vòng duy nhất. - Tham gia fultime t2 - t6. Sau 3 tháng đào tạo offer 10-15m! #Senior #Junior full các job với offer upto 1k -1k5 Apply gửi CV về nguyenthanhtra07092004@gmail.com Tiêu đề [Họ Tên]-[Vị trí apply]",4-10-2022 16:16,,4,1,Xin phép admin!!,58,https://www.facebook.com/groups/174764463261090/posts/1314787669258758/?__cft__[0]=AZVL9SuP6kpYYtQb53rEyMt1cZeWKi8xq04pIW8mh46UtfDAl2XI2tGB3tBykoKtn2LX3m5s3w1sYaT7QxL92Ld2FBr764Rb9_tVKmgvwRvSCTe7lMTu-jpLnyGpnRXudmkXFfC3bEQiZ75cp-LhBcq4&__tn__=%2CO%2CP-R,Nguyễn Thanh Trà,186
4,"[HN] Tuyển dụng Fresher Cloud Engineer  Lương 15-25M Chấp nhận SV năm cuối, lộ trình đào tạo rõ ràng",12-10-2022 09:14,,0,1,[HN] Tuyển dụng Fresher Cloud Engineer,24,https://www.facebook.com/groups/174764463261090/posts/1321473561923502/?__cft__[0]=AZUfODn7yY0D1ZuSZ95-uEMnel1pq_4DxjxChCoN16aoBuLB5fzO8astGyQyoavcO_YMR3O3e-Hih_c1IHjiQ10UwuRa7df_QwYX_TceYskagyx4i0ajyqm78_VYFG6nZoDgkSUO_PGiadhNzWyYBOWT&__tn__=%2CO%2CP-R,Nguyễn HR,240
5,"[𝐅𝐏𝐓 SOFTWARE] TUYỂN DỤNG FRESHER LẬP TRÌNH VIÊN Không yêu cầu kinh nghiệm – Được đào tạo Làm việc cho doanh nghiệp Việt Nam & Nước Ngoài ĐỐI TƯỢNG TUYỂN DỤNG: - Sinh viên từ năm 3 thuộc chuyên ngành CNTT - Các bạn thuộc chuyên ngành khác muốn thử sức trong lĩnh vực IT - Người muốn chuyển sang nghề lập trình. • Chấp nhận Non IT. QUYỀN LỢI • Cam kết được kí hợp đồng với doanh nghiệp ít nhất 1 năm khi đã hoàn thành khoá đào tạo • Mức lương khởi điểm từ tối thiểu từ 8 -12 triệu, có thể hơn tùy theo năng lực của từng cá nhân, lương thưởng đầy đủ. • Ứng viên được tự lựa chọn nơi làm việc theo mong muốn, doanh nghiệp có các chi nhánh ở Hà Nội,Đà Nẵng, TP HCM...), và cả ở nước ngoài: Nhật Bản, Úc,.. ngay sau khi học đào tạo xong. YÊU CẦU - Trải qua 1 khóa đào tạo ngắn về lập trình để nâng cao kiến thức chuyên môn trước khi đi vào làm việc chính thức( có trợ cấp tuỳ vào năng lực khi phỏng vấn nhé từ 5-7M) - Nghiêm túc, có chí muốn theo nghề Bạn nào quan tâm, muốn đăng kí nhận hỗ trợ đào tạo vui lòng inbox cho mình nhé. Apply to: uonghangkin@gmail.com",23-7-2022 22:58,,14,1,[𝐅𝐏𝐓 SOFTWARE] TUYỂN DỤNG FRESHER LẬP TRÌNH VIÊN,211,https://www.facebook.com/groups/174764463261090/posts/1264211630983029/?__cft__[0]=AZV8WXegJZad5UvTUHs9gDoxDSVfcsmF7hoTjPd9EjDuqzK-JI4BINgf7ol318BaxlAytG6IWrhB5d9kP0YEEiZXf2IdN67pUsssunyn2xh9BvCUO14-woaWQtslwBOZquiiX4ruQNiJo46OieEWkvcF&__tn__=%2CO%2CP-R,Hằng Kin,249
6,|HN| tìm UV cho job FRESHER !!! 1. FRESHER ANDROID DEVELOPER - 6 tháng kn làm việc với Java Android. - Biết Kotlin và làm việc với những công nghệ mới RxJava ... - Tiếng anh đọc hiểu. 2. Fresher Unity Developer - Có từ 6 tháng kn thực tế lập trình ngôn ngữ Unity - Có sản phẩm game demo,1-10-2022 16:01,,0,1,|HN| tìm UV cho job FRESHER !!!,8,https://www.facebook.com/groups/174764463261090/posts/1312299029507622/?__cft__[0]=AZWGfWeuFHtqAHMgJW-IGPfdP5cdNQj2W6v-tZIsfNJuDZPmPYdEQk9SkMMUKC-tzp_vnXLogfqqwO8qujPDYUNxcdayFUi55ttR_MvV3Gr_RL1atzZEEZTKvN2JlVsSUYZxLP8yufEeMFYx1PKyKpMy&__tn__=%2CO%2CP-R,Phương Edward,351
7,"[HCM] Tuyển dụng Intern/ Fresher đợt tháng 9  Công ty 1C Innovation hoạt động về mảng ERP mở tuyển đợt mới vị trí Developer cho intern/fresher. ĐC: Toà Mesa, 202 Lý Chính Thắng, Q.3, TP HCM. Môi trường trẻ trung, đãi ngộ siêu tốt   Yêu cầu: Part time: open cho sinh viên năm 3 và 4 với intern, full time cho fresher Biết ít nhất 1 ngôn ngữ code (ưu tiên Flutter) Có tiếng Anh là 1 lợi thế   Chế độ:  Intern có phụ cấp và flexible về thời gian, đc nhận ngay sau khi training. Mức lương hấp dẫn, đóng bảo hiểm từ khi ký hợp đồng, nhận lương net. Đồng nghiệp thân thiện, môi trường nhiều cơ hội phát triển bản thân. Làm việc từ 9am-6pm, Mon-Fri   Apply: gửi CV về email ly.duong@1ci.vn ",4-9-2022 15:10,,8,1,[HCM] Tuyển dụng Intern/ Fresher đợt tháng 9,101,https://www.facebook.com/groups/174764463261090/posts/1292529454817913/?__cft__[0]=AZVpDSgdL3yGmoQx7KgyWLK4pIq08N2IuN8_BIBzkDGndrmOd5REPfdHwtgeYqtlaT3ygxN10oyEex7jgm-olNTFFvHet7DntdstRu777ZnOmOFoCnsaTcwAB7kjP1qs0fYqEhchXxJyiWIZxqrRAEyG&__tn__=%2CO%2CP-R,Ly Duong,352
8,"Evotek tuyển dụng Fresher NodeJS/Java/FrontEnd Yêu cầu: · Sinh viên năm cuối, Có thể đi làm fulltime · Đã có kinh nghiệm thực tế · Nhanh nhẹn, hòa đồng, năng nổ Benefits: · Hỗ trợ 3-10M cho TTS, Fresher up to 15M tùy thuộc vào kỹ năng và mức độ đóng góp cho Công ty . · Có cơ hội được điều chỉnh mức phụ cấp và ký HĐ với Công ty khi có đánh giá và đề xuất của quản lý trực tiếp. · Được hướng dẫn và đào tạo bởi các trưởng nhóm có kinh nghiệm. · Tham gia vào các dự án thực tế tại Công ty. Địa chỉ: Dịch Vọng Hậu, Cầu Giấy, Hà Nội. Thời gian làm việc: Thứ 2 - thứ 6, 8h30-17h30 Contact để nhận Jd chi tiết công việc. CV gửi về: hang.nguyenthanh@evotek.vn",23-9-2022 20:43,,1,1,Evotek tuyển dụng Fresher NodeJS/Java/FrontEnd,34,https://www.facebook.com/groups/174764463261090/posts/1306163806787811/?__cft__[0]=AZXaxzchxfdjzV2XTq5YnhjF3kg4JW19Ky5MWXM5qOQsXDqwqzYBZfRbifJTKOl574aK8cLdANqtyw0cHuT_PDMMJBHKsgL0D1-Vv3jVMHTusCkyLoa9Pckw1UTfnvLUMNwCgHeblldhQ6iIwwar5bH3&__tn__=%2CO%2CP-R,Thanh Hằng,449
9,"Evotek tuyển dụng Fresher NodeJS/Java/FrontEnd Yêu cầu: · Sinh viên năm cuối, Có thể đi làm fulltime · Đã có kinh nghiệm thực tế  · Nhanh nhẹn, hòa đồng, năng nổ Benefits: · Hỗ trợ 3-10M cho TTS, Fresher up to 15M tùy thuộc vào kỹ năng và mức độ đóng góp cho Công ty . · Có cơ hội được điều chỉnh mức phụ cấp và ký HĐ với Công ty khi có đánh giá và đề xuất của quản lý trực tiếp. · Được hướng dẫn và đào tạo bởi các trưởng nhóm có kinh nghiệm. · Tham gia vào các dự án thực tế tại Công ty. Địa chỉ: Dịch Vọng Hậu, Cầu Giấy, Hà Nội. Thời gian làm việc: Thứ 2 - thứ 6, 8h30-17h30 Contact để nhận Jd chi tiết công việc. CV gửi về: hang.nguyenthanh@evotek.vn",21-9-2022 16:30,,1,1,Evotek tuyển dụng Fresher NodeJS/Java/FrontEnd,73,https://www.facebook.com/groups/174764463261090/posts/1304719310265594/?__cft__[0]=AZU-Yh3XYHmco3eBhfoxE08YUGD-I0kA5RbTScSaqkqzoPBIYfQYJflNA5aKM9DeOaHG5XyDhZVbPelNbeVgKP__mymN07n-yMeO5VXPtcln2wZVbtLp5vEjhtpOvotSKZgsNoorxD6oFvw3kA-Wl5FH&__tn__=%2CO%2CP-R,Thanh Hằng,477
10,"itCommerce cần tuyển Fresher Python Developer fulltime - KHÔNG YC KINH NGHIỆM - ĐÀO TẠO TỪ ĐẦU Được đào tạo bài bản từ A-Z Có hỗ trợ 8.000.000-12.000.000đ/ tháng Chấp nhận sinh viên mới ra trường, chờ bằng, trái ngành Yêu cầu: tiếng Anh cơ bản, đã từng tìm hiểu về Python, có định hướng lập trình Web, app Địa chỉ làm việc: Tòa Lilama 10 - Tố Hữu - NTL - HN Gửi CV: hr@litcommerce.com",6-10-2022 11:07,,1,1,itCommerce cần tuyển Fresher Python Developer fulltime - KHÔNG YC KINH NGHIỆM - ĐÀO TẠO TỪ ĐẦU,10,https://www.facebook.com/groups/174764463261090/posts/1316316695772522/?__cft__[0]=AZXwoH52WWUzMuz5AgC-gxxZ3YNCQGuqIXRWYx7jBKXbwj5WE_3IJ6sKh8sN9ltg2acmcqwunIfk48yQbfEVKoEcNJ0v4FBFUT35rUyRVyn8NR7rI-vvR6NvpwaDJTM8AknN3OS1qbZVSgg4-Ewze_FX&__tn__=%2CO%2CP-R,Diệp Nguyễn,544
11,"[HN] Tuyển 30 fresher web, đào tạo fullstack, không y/c kinh nghiệm, cấp dấu thực tập, hỗ trợ đồ án TN, lên nhân viên sau 2 tháng",5-10-2022 22:11,,2,1,"[HN] Tuyển 30 fresher web, đào tạo fullstack, không y/c kinh nghiệm, cấp dấu thực tập, hỗ trợ đồ án TN, lên nhân viên sau 2 tháng",56,https://www.facebook.com/groups/174764463261090/posts/1315542589183266/?__cft__[0]=AZX20ZG-mf-vfsgqBC8DcYH9cX9rRfvx1e8gvazWwWB9dN7z_GG7klwonKOqeNWHCMZhsSSw5ax4q536rcNddGQKL3un99BiDLXlHXqbGKKjYZVwRaFC9i0zn7EPr5lVrV_OM2Kftl7LFmPXpMVKEVKs&__tn__=%2CO%2CP-R,Phuong Anh,554
12," [𝐻𝑎̀ 𝑁𝑜̣̂𝑖] 𝐶𝑜̂𝑛𝑔 𝑡𝑦 𝑐𝑜̂̉ 𝑝ℎ𝑎̂̀𝑛 𝑉𝐶𝐶𝑜𝑟𝑝 𝐓𝐔𝐘𝐄̂̉𝐍 𝐃𝐔̣𝐍𝐆 - Java Backend (Fresher => Dev) - IOS (Intern => Dev) - PHP (Fresher => Dev) - ReactJS (Fresher => Dev) - C#, .Net (Fresher => Dev) - VueJS (Fresher => Dev) Lương, thưởng, chế độ đãi ngộ hấp dẫn Môi trường làm việc trẻ trung, năng động, sếp tâm lý, thoải mái Văn phòng trang bị đầy đủ thiết bị hiện đại ----- Thông tin liên hệ: CV gửi về địa chỉ mail: tonhi1912001@gmail.com Zalo/Telegram: 0392077320 Ib ngay để nhận JD, trao đổi chi tiết ạ!",29-7-2022 16:51,,3,1, [𝐻𝑎̀ 𝑁𝑜̣̂𝑖] 𝐶𝑜̂𝑛𝑔 𝑡𝑦 𝑐𝑜̂̉ 𝑝ℎ𝑎̂̀𝑛 𝑉𝐶𝐶𝑜𝑟𝑝,32,https://www.facebook.com/groups/174764463261090/posts/1267931197277739/?__cft__[0]=AZVVzFR5fqssmyqA179paM1oZyG5fXJT-035HljY0IyMXj7vr3hC7VHNsUPyJUqDSNM5GlbBTm9kQWhtLQ572wmvHeXvZVnUKhHmluDifsVSBTuY5SbsaRSMAYRkV3SUwkew7_ukB30H2SQjf3B9GTXi&__tn__=%2CO%2CP-R,Hồng Dương,587
13,"[HCM] Intern/Fresher Wanted  Công ty 1C Innovation hoạt động về mảng ERP mở tuyển đợt mới vị trí Developer cho intern/fresher. ĐC: Toà Mesa, 202 Lý Chính Thắng, Q.3, TP HCM. Môi trường trẻ trung, đãi ngộ siêu tốt   Yêu cầu: Part time: open cho sinh viên năm 3 và 4 với intern, full time cho fresher Biết ít nhất 1 ngôn ngữ code, logic tốt Có tiếng Anh là 1 lợi thế  Chế độ: intern có phụ cấp và flexible về thời gian, đc nhận ngay sau khi training. Mức lương hấp dẫn, đóng bảo hiểm từ khi ký hợp đồng, nhận lương net. Đồng nghiệp thân thiện, môi trường nhiều cơ hội phát triển bản thân. Làm việc từ 9am-6pm, Mon-Fri  Apply: gửi CV về email ly.duong@1ci.vn ",17-7-2022 08:50,,3,1,[HCM] Intern/Fresher Wanted,105,https://www.facebook.com/groups/174764463261090/posts/1259545918116267/?__cft__[0]=AZW9SViapRcFiB00xcbxB33U0JmnuerN83_Zff68KGN2PwfTQlqAs0WVVL90VSJU5aH8DyBY-En5F5icvz5kH9G7L_dM9LMIP98iY7_YEwmJkcm2kfnWylOimMqyXZyS_nsJjGr_N3DtVNEAQIEDZLHy&__tn__=%2CO%2CP-R,Ly Duong,617
14,"VNPT - IT tuyển dụng Fresher fulltime/parttime Khu vực: Hà Nội, HCM, Đà Nẵng, Hải Phòng, Tiền Giang Các vị trí tuyển dụng: Lập trình (PHP, Java, .Net, Python, Nodejs, Frontend, iOS, Android, Flutter) Manual Tester AICV / AI NLP (Hà Nội) Data Engineer (Hà Nội) An toàn thông tin (Hà Nội) Gửi CV + bảng điểm để ứng tuyển Chương trình áp dụng cho các bạn sinh viên năm cuối hoặc mới tốt nghiệp không quá 1 năm khối ngành CNTT, ATTT Nhận lương lên đến 10tr/tháng tùy vị trí công việc ngay từ thời gian đào tạo Tham gia miễn phí các khóa đào tạo chuyên môn & kỹ năng mềm Tham gia hỗ trợ phát triển các sản phẩm với hàng chục triệu người dùng. Được tư vấn & định hướng nghề nghiệp từ các Mentors - những chuyên gia hàng đầu trong lĩnh vực CNTT. Cơ hội được tuyển dụng chính thức tại VNPT sau thời gian đào tạo với mức thu nhập năm hấp dẫn kèm các chế độ phúc lợi từ Tập đoàn VNPT ------------------------------------------------- Gửi hồ sơ ứng tuyển đến email: bannhansu.vnptit@vnpt.vn Tiêu đề email ghi rõ: Họ và tên_Vị trí dự tuyển_Địa bàn ứng tuyển",21-7-2022 17:32,,16,1,VNPT - IT tuyển dụng Fresher fulltime/parttime,148,https://www.facebook.com/groups/174764463261090/posts/1262877564449769/?__cft__[0]=AZW7rLdS2lKaqmyCca-uBBEjLRQV1I7GCktAFceuebxodq_bvagO39oqAeM7bEIoaBC8FGGUZrA704Vg206TXIchQDAr7aF7uz1XSdTkzHQ9AnO-OxZAjYeTwmkJ1pj2GK5d4bzk2Y7GLXxMjE_5xhhH&__tn__=%2CO%2CP-R,Tờ Jan,721
15,"TUYỂN DỤNG FRESHER [ FPT SOFTWARE HN, HCM] Các list job đa dạng dành cho các bạn sinh viên năm cuối hoặc mới tốt nghiệp các ngành CNTT, Điện tử viễn thông, Kỹ thuật phần mềm,... Không yêu cầu kinh nghiệm, được đào tạo bài bản Hỗ trợ lương 5-8M/ tháng Đào tạo Online Apply to: TinhVD1@fsoft.com.vn với tiêu đề [Vị trí ứng tuyển] _ [Họ và tên] #tuyendung #Fresher",10-2-2022 14:07,,4,1,"TUYỂN DỤNG FRESHER [ FPT SOFTWARE HN, HCM]",114,https://www.facebook.com/groups/174764463261090/posts/1151348138936046/?__cft__[0]=AZVle5TR-yxdCSPuI2xmV_zQhAim2sNi2RE-mdb_gyZsD9AN9RKdciBBaoP4NMkFZAm-o2jZgtDjN_7FVmAXB8oG5xDBpn0Ph77iXPkspVgg4D9S1RT6JCB_IoSc5u14x9drGHOOC7qSbC-I7v7LG5kZ&__tn__=%2CO%2CP-R,Vũ Đăng Tình,862
16,"HN CẦN TUYỂN INTERN/ FRESHER C/C++ Software Engineer ( Fresher)- LG Offer $550- $2.000 ReactJS (Intern / fresher ) – BraveBits ( 6-10M) Python Intern – LitComemerce ( 6-8M) Thực tập sinh Ruby ( NAL) Hỗ trợ hàng tháng , gắn bó với nghề . Cơ hội lên chính thức . Quan tâm ib m gửi JD nhé",,,2,1,HN CẦN TUYỂN INTERN/ FRESHER,105,https://www.facebook.com/groups/174764463261090/posts/1295880801149445/?__cft__[0]=AZXD19LRCPvTkaL3t451crShoF2qROh4YA50Nv6Ojy1EpRGo1MdK2S5adKZwRJ3DE5uWvBrOqUacj-1SGP-31PBuoRPE1xMV2d0X1l8fxMCzXP_9LQwLv5G59GzOJunhjRAiswJNP7RDuSotrDOZraUw&__tn__=%2CO%2CP-R,Bình An,975
17,"HN CẦN TUYỂN INTERN/ FRESHER C/C++ Software Engineer ( Fresher)- LG Offer $550- $2.000 ReactJS (Intern / fresher ) – BraveBits ( 6-10M) Python Intern – LitComemerce ( 6-8M) Thực tập sinh Ruby ( NAL) Hỗ trợ hàng tháng , gắn bó với nghề . Cơ hội lên chính thức . Quan tâm ib m gửi JD nhé",9-9-2022 08:59,,2,1,HN CẦN TUYỂN INTERN/ FRESHER,105,https://www.facebook.com/groups/174764463261090/posts/1295880801149445/?__cft__[0]=AZXD19LRCPvTkaL3t451crShoF2qROh4YA50Nv6Ojy1EpRGo1MdK2S5adKZwRJ3DE5uWvBrOqUacj-1SGP-31PBuoRPE1xMV2d0X1l8fxMCzXP_9LQwLv5G59GzOJunhjRAiswJNP7RDuSotrDOZraUw&__tn__=%2CO%2CP-R,Bình An,1069
18,"[HN] POST NÀY TUYỂN INTERN VÀ FRESHER Python Intern/Fresher ReactJs Fresher/Intern Java Fresher .NET/ C# Fresher PHP Fresher C++ Fresher Mobile Developer Intern (Flutter/React Native) React Native Golang Fresher/Intern Lương/trợ cấp hấp dẫn, cơ hội lên chính thức và lộ trình thăng tiến rõ ràng. Quan tâm inbox mình gửi JD từng vị trí nhé.",,,2,1,[HN] POST NÀY TUYỂN INTERN VÀ FRESHER,125,https://www.facebook.com/groups/174764463261090/posts/1283546052382920/?__cft__[0]=AZUSWYg5fymhBTBJIt4DpwhSEJC3FSB7x348ykFHAl7wn_dyzwPyWB0I-3uyhdTLDLdL6-CwVmSQ-4KKbb24E-1tgpnegPCpGGxtOlRAYvQmlp289zifHKlULWaAs8M8THQcOQQ5o4r88YS8R5rrYJiT&__tn__=%2CO%2CP-R,Anh Nguyen,1163
19,"Công ty công nghệ CHIÊU MỘ FRESHER PHP, PYTHON, RUBY Nếu bạn đang là SINH VIÊN NĂM 4/ CÁC BẠN MỚI RA TRƯỜNG KHÔNG YÊU CẦU KINH NGHIỆM đang cần tìm môi trường gắn bó. Hãy về với đội của Miagi Solution Quyền lợi được hưởng: Được làm task dự án thực tế Lương khởi điểm hấp dẫn 6-10M On job training, review lương định kì Lương tháng thứ 13, thưởng lễ tết, thưởng dự án Phụ cấp gửi xe, ăn trưa, beauty care. Chân dung ứng viên: Có kiến thức nền tảng vẵng bất kì ngôn ngữ nào Tinh thần, thái độ nghiêm túc trong công việc Làm dự án cá nhân, đội nhóm về web Gửi CV qua SĐT:0348193076 Email: hr@miagi-so.com",,,1,1,"Công ty công nghệ CHIÊU MỘ FRESHER PHP, PYTHON, RUBY",13,https://www.facebook.com/groups/174764463261090/posts/1321512991919559/?__cft__[0]=AZX2glMK_4qmTHRAAsL7WYx7cClF9sscvkDw7u8fX7YPpmQoY9BkGX0KxzOLY7RGUDMStyh0BYJBpCkgTEAjn3_o2Z3Q4wxnySlOGK-NL9O2xunkJ4lMJHZZ9R4PEJoKJu1pVO3UCNtWO9eb9I3h3M6L&__tn__=%2CO%2CP-R,Vu Hong Ngoc,1277
20,"POST NÀY TUYỂN #FRESHER JAVA, PYTHON (DJANGO) VỀ ""OÁNH"" LOL CÙNG VIETIS ( ´ ▽ ` ) Job dành cho các bạn sinh viên năm cuối/mới tốt nghiệp Làm việc full-time từ thứ 2 - thứ 6 Được đào tạo bài bản bởi mentor dày dặn kinh nghiệm Chỉ cần đã thực tập/làm đồ án/dự án cá nhân sử dụng Java, Python (Django) --- CV ứng tuyển các bạn gửi về mail linhnb@vietis.com.vn Inbox mình để được tham khảo kỹ hơn về từng vị trí Cảm ơn đã đọc tin ạ ( ´ ω ` )",12-9-2022 22:47,,1,1,"POST NÀY TUYỂN #FRESHER JAVA, PYTHON (DJANGO) VỀ ""OÁNH"" LOL CÙNG VIETIS ( ´ ▽ ` )",49,https://www.facebook.com/groups/174764463261090/posts/1298341967569995/?__cft__[0]=AZXt5B6VHH6DOfDPy_2POkEQtpyGCQGBJLP7rh4iD0khMVpogHY2kBJVdoGZkoyhUXu1wPnUJ-wgMAX0o7yAdzXMMV9JnIu0DWhNbYwYNTosMdgABXAYB_CFRqDmQ0ZLH1kjFAT0agbHxQb2M34ek56I&__tn__=%2CO%2CP-R,Bao Linh Nguyen,1291
21,"[Kaopiz software] TUYỂN DỤNG INTERN/FRESHER TESTER QUYỀN LỢI: Đào tạo miễn phí trong 2 tháng, có trợ cấp Lương sau đào tạo upto 15M (Fresher), upto 60k/giờ (Intern) Định hướng cho các vị trí quản lý trong tương lai YÊU CẦU: Không yêu cầu kinh nghiệm Sinh viên năm cuối/cận cuối/mới tốt nghiệp, GPA >= 2.5 Ứng viên có base IT Chi tiết vui lòng liên hệ mình để được tư vấn rõ hơn nhé!",19-9-2022 16:12,,8,1,[Kaopiz software] TUYỂN DỤNG INTERN/FRESHER TESTER,72,https://www.facebook.com/groups/174764463261090/posts/1303126110424914/?__cft__[0]=AZVMikFkvqfcMd9VsSHAVkDR72XVqb3yG_GqOvL4nloctuEmAnBh1ot0W0OLcefdOf-9GDHv2v4N-CZJin3o7GJSHA2XjTimauttOyIumMIS9MiZHVmsoMIZUO0JuT03MoGGNr-1lvzQnpL6hhF-bvBf&__tn__=%2CO%2CP-R,Phuong Anh,1336
22,"Công ty công nghệ CHIÊU MỘ FRESHER PHP, PYTHON, RUBY Nếu bạn đang là SINH VIÊN NĂM 4/ CÁC BẠN MỚI RA TRƯỜNG KHÔNG YÊU CẦU KINH NGHIỆM đang cần tìm môi trường gắn bó. Hãy về với đội của Miagi Solution Quyền lợi được hưởng: Được làm task dự án thực tế Lương khởi điểm hấp dẫn 6-10M On job training, review lương định kì Lương tháng thứ 13, thưởng lễ tết, thưởng dự án Phụ cấp gửi xe, ăn trưa, beauty care. Chân dung ứng viên: Có kiến thức nền tảng vẵng bất kì ngôn ngữ nào Tinh thần, thái độ nghiêm túc trong công việc Làm dự án cá nhân, đội nhóm về web Gửi CV qua SĐT:0348193076 Email: hr@miagi-so.com",12-10-2022 14:25,,1,1,"Công ty công nghệ CHIÊU MỘ FRESHER PHP, PYTHON, RUBY",13,https://www.facebook.com/groups/174764463261090/posts/1321512991919559/?__cft__[0]=AZX2glMK_4qmTHRAAsL7WYx7cClF9sscvkDw7u8fX7YPpmQoY9BkGX0KxzOLY7RGUDMStyh0BYJBpCkgTEAjn3_o2Z3Q4wxnySlOGK-NL9O2xunkJ4lMJHZZ9R4PEJoKJu1pVO3UCNtWO9eb9I3h3M6L&__tn__=%2CO%2CP-R,Vu Hong Ngoc,1366
23,"Tuyển dụng Fresher/Intern/LTV tại cả HN và HCM nhiều vị trí  Quyền lợi: - Được đào tạo lý thuyết và on job training 1 - 3 tháng, trợ cấp up to 6 triệu/tháng - Được làm việc trong môi trường chuyên nghiệp, trẻ trung và năng động - Được tham gia vào các dự án lớn về thương mại điện tử, khách hàng quốc tế. - Có cơ hội trở thành nhân viên chính thức sau quá trình thực tập Yêu cầu: - Sinh viên năm 3, 4 hoặc đã tốt nghiệp ngành CNTT hoặc các ngành liên quan, xếp loại khá, giỏi. - Có thể tham dự đào tạo full-time - Tiếng Anh tốt hoặc có kết quả học tập tốt/ thành tích tốt sẽ có lợi thế đặc biệt. Các bạn quan tâm ib mình gửi JD nhé.",,,1,1,Tuyển dụng Fresher/Intern/LTV tại cả HN và HCM nhiều vị trí ,39,https://www.facebook.com/groups/174764463261090/posts/1279273389476853/?__cft__[0]=AZUhHj3N2Gqfv49w5UEpJD5eeSl3tD7NNX3vlGaTe7jNcGf9tfHu8iG18oQoTS0UorTSDLP5XWtE47Cv2Nb3MROBrCmy5pKQ8z6STdRmT1RAfiKB6nSldYrp2Fh0uoTuCRYH4bQQ-GRE_wdDbqKZ6V4o&__tn__=%2CO%2CP-R,Eiramy Hoang,1380
24,"[CG -HN] Công ty Cổ phần BlueCo Toàn Cầu tuyển fresher, thực tập sinh Java. KHÔNG yêu cầu kinh nghiệm Chấp nhận sinh viên mới ra trường hoặc sinh viên năm cuối Hỗ trợ 3-5M/ tháng Hỗ trợ dấu thưc tập Môi trường năng động, Sếp thoải mái Nhiều cơ hội phát triển Có cơ hội gắn bó lâu dài với Công ty Mọi thông tin quan tâm ib mình nhé.",11-10-2022 14:17,,1,1,"[CG -HN] Công ty Cổ phần BlueCo Toàn Cầu tuyển fresher, thực tập sinh Java.",57,https://www.facebook.com/groups/174764463261090/posts/1320710578666467/?__cft__[0]=AZV716ajw2cqJG4jKjg_SpO89oAm_FkS3yEEVRNkugG7iOSbj3fPHidHtzzUQYVeedK7L3UagkU1FZmLi-1HUZN0qfzXYLjY8gXlIWzSJagN8BDeR10W4cHgHuPy8bnYdyQEPyVk9w24Dj5jXank8hQu&__tn__=%2CO%2CP-R,Nguyễn Nhung,1420
25, [FPT SOFTWARE] Tuyển dụng #Fresher  Đào tạo lại từ đầu không yêu cầu kinh nghiệm  hỗ trợ lương 5M- 7M/tháng  sau 3 tháng đào tạo lương 10M-15M Tuyển dụng #Senior #junior các job với mức lương 15M - 35M  Các bạn quan tâm ib  Gửi CV về email minhit.hnue@gmail.com nha ,2-10-2021 20:34,,8,1, [FPT SOFTWARE],229,https://www.facebook.com/groups/174764463261090/posts/1068749983862529/?__cft__[0]=AZXmr2Getskk7XhBfuFHnHTIU45dwEKG9Row18qBrFVDz5wVAgrlro9-NRwQAHWXIKbVzQ8BAHUiFfgArJ78bKBTS-6Vv1QblqFlaDb1QVne1ouagu76LApfdqKOfrYFupmLJ-8tVsUeXxWS-HAerP_m&__tn__=%2CO%2CP-R,Hoàng Minh,1477
26,"Xin phép admin!! [FPT SoftWare HN - ĐN] Tìm kiếm fresher Tháng 10 #Fresher Đào tạo từ đầu hỗ trợ 5-9m/tháng Vi trí: .NET Java Auto Test Embedded - Không yêu cầu ứng viên có kinh nghiệm làm việc ngoài, chỉ cần có kinh nghiệm tham gia dự án trong lúc đi học. - Đào tạo lại từ đầu, - PV 1 vòng duy nhất, Sau 3 tháng đào tạo offer 10-15m! #Senior #Junior full các job với offer upto 1k -1k5 Apply gửi CV về nguyenthanhtra07092004@gmail.com Tiêu đề [Họ Tên]-[Vị trí apply]",16-9-2022 18:03,,3,1,Xin phép admin!!,78,https://www.facebook.com/groups/174764463261090/posts/1300493280688197/?__cft__[0]=AZWeVS1iCm_p_369i9lonJNXieSUI6uT4u5mPRmaMvefisz96pNcuKSZIu-IuwOMEm0Og73rCN3d3-mi4tNbg1I-uxtr4COUvZHVprXn39vxFw9LyhcmfQzjDUFBTgLtzzWy_isa-eH36a6U0ESNaX-c&__tn__=%2CO%2CP-R,Nguyễn Thanh Trà,1490
